Name,alternateName,sowInstructions,spaceInstructions,harvestInstructions,compatiblePlants,avoidInstructions,culinaryHints,culinaryPreservation,url
Sweet corn,Maize,Sow maize in the garden. Sow the seed at a depth approximately three times the diameter of the seed. Maize is best planted at soil temperatures between 61°F and 95°F.,Space plants 8 - 12 inches apart.,Harvest them in 11-14 weeks.,"Maize can grow beside all beans, cucumber, melons, peas, pumpkin, squash, and amaranth.",Avoid growing maize close to Celery.,Pick and cook maize within an hour. Remove the silks and outer leaves. Maize has the best flavour if you microwave it about 4 minutes per cob. Can be barbequed wrapped in foil. Cook large amounts in a stock pot until test soft. Sprinkle with black pepper and dip in butter.,,http://gardenate.com/plant/Sweet%2Bcorn
Sweet Marjoram,Knotted marjoram,"Grow sweet marjoram in seed trays, and plant out in 4-6 weeks. Sow the seed at a depth approximately three times the diameter of the seed. Sweet marjoram is best planted at soil temperatures between 50°F and 77°F.",Space plants 8 inches apart.,Harvest them in 8-10 weeks. Sweet marjoram is best flavour if picked before flowering.,"Sweet marjoram can grow beside Peppers (Capsicums, Chilis) and Sage.,",,"Sweet Marjoram has a mild oregano flavor with a hint of balsam. Sweet Marjoram can be used as a substitute for oregano in sauces for mediterranean style pizza, lasagna, and eggplant parmigiana.",,http://gardenate.com/plant/Sweet%2BMarjoram
Sweet Potato,Kumara,Plant shoots or cuttings (Slips) of sweet potato. Sweet potatoes are best planted at soil temperatures between 63°F and 95°F.,Space plants 16 - 24 inches apart.,Harvest them in 15-17 weeks.,Sweet potatoes grow best in a separate bed.,,"Use sweet potatoes mashed, boiled, roasted, baked or fried. Or use in soups, pies, casseroles, curries and salads.",,http://gardenate.com/plant/Sweet%2BPotato
Taro,"Dasheen, cocoyam","Plant small pieces of taro tuber or suckers, 5-8cm deep. Taro is best planted at soil temperatures between 68°F and 95°F.",Space plants 31 inches apart.,Harvest them in approximately 28 weeks when the leaves begin to die down.,Taro grows best in a separate bed,,"Taro can be cooked like potatoes, boiled, roasted, fried or steamed. It is not eaten raw.",,http://gardenate.com/plant/Taro
Thyme,Common thyme,Grow thyme in seed trays and plant out 6-8 weeks. Sow the seed at a depth approximately three times the diameter of the seed. Thyme is best planted at soil temperatures between 59°F and 77°F.,Space plants 10 - 12 inches apart.,Harvest them in 42-52 weeks. Root divisions ready in 3 months.,"Thyme can grow beside Dry-environment herbs (oregano,sage), Eggplant, and Cabbage.",,"Common, lemon, orange and caraway thyme are used in cooking. Thyme is mainly used with meat and fish but also tastes good with vegetables such as mushrooms, beans and carrots. The flavour can be very intense so thyme is best used sparingly.",,http://gardenate.com/plant/Thyme
Tomatillo,,"Tomatillos are easy to grow. Grow them in seed trays, and plant out in 4-6 weeks. Sow the seed at a depth approximately three times the diameter of the seed. Tomatillos are best planted at soil temperatures between 70°F and 81°F.",Space plants 28 inches apart.,Harvest them in 10-14 weeks. The husk splits when fruit is ripe.,Tomatillos can happily grow in a flower border.,,Use tomatillos in spicy sauces with or to replace tomatoes. They are the base of salsa verde in Mexican cookery.,,http://gardenate.com/plant/Tomatillo
Tomato,,"Grow tomatoes in seed trays, and plant out in 4-6 weeks. Sow the seed at a depth approximately three times the diameter of the seed. Tomatoes are best planted at soil temperatures between 61°F and 95°F.",Space plants 16 - 24 inches apart.,Harvest them in 8-17 weeks.,"Tomatoes can grow beside Asparagus, Chervil,Carrot, Celery, Chives, Parsley, Marigold, and Basil.","Avoid growing tomatoes close to Rosemary, Potatoes, and Fennel.","Use tomatoes in sauces, with fried meals, in sandwiches.",Tomatoes can be frozen whole or in pieces.,http://gardenate.com/plant/Tomato
Turnip,,Turnips are easy to grow. Sow them in the garden. Sow the seed at a depth approximately three times the diameter of the seed. Turnips are best planted at soil temperatures between 12°C and 30°C.,Space plants 12 - 20 cm apart.,Harvest them in 6-9 weeks.,"Turnips can grow beside Peas, Beans, Chives, Spinach, Carrots, and Chicory.","Avoid growing turnips close to Potatoes or Tomatoes.",Grate young turnips and use them raw in salads. Use older turnips in casseroles and stews.,,http://gardenate.com/plant/Turnip
Watermelon,,"Grow watermelon in seed trays, and plant out in 4-6 weeks. Sow the seed at a depth approximately three times the diameter of the seed. Watermelon is best planted at soil temperatures between 70°F and 95°F.",Space plants 24 - 30 inches apart.,Harvest them in 12-17 weeks.,"Watermelon can grow beside Sweetcorn and Sunflowers.",Avoid growing watermelon close to Potatoes.,Cut watermelon up and eat in slices. Use it to make fruit drinks or in fruit salads.,,http://gardenate.com/plant/Watermelon
Yacon,Sunroot,Yacon is easy to grow. Plant the sprouting root/tuber to a depth of about 4cm and mulch to cover. Yacon is best planted at soil temperatures between 50°F and 77°F.,Space plants 39 inches apart.,Harvest them in approximately 25 weeks. You can collect a few at a time without digging out the whole plant.,Yacon grows best in a separate bed.,,"The large roots can be used raw in salads peel and chop. Sprinkle with lemon juice to prevent browning. 'In the Andes, they are grated and squeezed through a cloth to yield a sweet refreshing drink. The juice can also be boiled down to produce a syrup. In South America the juice is concentrated to form dark brown blocks of sugar called chancaca.' (Green Harvest)",,http://gardenate.com/plant/Yacon
Zucchini,"Courgette/Marrow, Summer squash","Grow zucchini in seed trays, and plant out in 4-6 weeks. Sow the seed at a depth approximately three times the diameter of the seed. Zucchini is best planted at soil temperatures between 70°F and 95°F.",Space plants 20 - 35 inches apart.,Harvest them in 6-9 weeks. Cut the fruit often to keep producing.,"Zucchini can grow beside Corn, beans, nasturtiums, parsley, Silverbeet, and Tomatoes.",Avoid growing zucchini close to Potatoes.,Zucchini are best picked or cut off the stem at about 15cm / 6 inches. Pick frequently to keep the plant producing new flowers.,,http://gardenate.com/plant/Zucchini