Name,alternateName,sowInstructions,spaceInstructions,harvestInstructions,compatiblePlants,avoidInstructions,culinaryHints,culinaryPreservation,url
Garlic,,Garlic is easy to grow. Plant cloves. It is best planted at soil temperatures between 50°F and 95°F.,Space plants 4 - 5 inches apart.,Harvest them in 17-25 weeks.,"Garlic can grow beside Beets, Carrots, Cucumbers, Dill, Tomatoes, and Parsnips.","Avoid growing garlic close to Asparagus, Beans, Brassicas, Peas, and Potatoes.",Cut the growing shoots or use the entire young garlic plants as 'garlic greens' in stirfry.,,http://gardenate.com/plant/Garlic
Ginger,,Plant pieces of fresh ginger root showing signs of shoots. Ginger is best planted at soil temperatures between 20°C and 30°C.,Space plants 15 cm apart.,Harvest them in approximately 25 weeks. Reduce water as plant dies back to encourage rhizome growth.,Ginger should be grown in a separate bed.,,"Use in any recipes requiring fresh ginger. Widely used in Asian cooking, it is hot without the 'burn' of chilli.  "," Ginger root freezes well either whole or grated, and can be used direct from the freezer in most recipes requiring fresh ginger.",http://gardenate.com/plant/Ginger
Horseradish,,Horseradish is easy to grow. Plant root pieces. Horseradish is best planted at soil temperatures between 50°F and 77°F.,Space plants 20 inches apart.,Harvest them in 16-24 weeks. Some improvement in flavour if left till after frost.,Horseradish is best kept separate.,,"Strong, spicy flavour traditionally used with roast beef. Used grated for horseradish sauce or horseradish cream",,http://gardenate.com/plant/Horseradish
Jerusalem Artichokes,Sunchoke,"Sunchoke is easy to grow. Plant tubers about 5cm (1.5"") deep. Sunchoke is best planted at soil temperatures between 46°F and 59°F.",Space plants 12 - 18 inches apart.,Harvest them in 15-20 weeks.,"Sunchoke can grow beside Tomatoes and cucumbers.",,"Scrape clean or peel (add a tsp of lemon or vinegar to the water to stop the tubers browning). Steam, boil, or use in artichoke soup (make with artichokes and some stock). Caution - because they contain 'resistent starch' Jerusalem Artichokes are a great promoter of flatulence in some individuals.",,http://gardenate.com/plant/Jerusalem%2BArtichokes
Kale,Borecole,"Kale is easy to grow. Grow kale in seed trays, and plant out in 4-6 weeks. Sow the seed at a depth approximately three times the diameter of the seed. Kale is best planted at soil temperatures between 46°F and 86°F.",Space plants 20 - 39 inches apart.,Harvest them in 7-9 weeks.,"Kale can grow beside Dwarf (bush) beans, beets, celery, cucumber, onions, marigold, nasturtium, rhubarb, and aromatic herbs (sage, dill, camomile).","Avoid growing kale close to Climbing (pole) beans, tomato, peppers (chilli, capsicum), eggplant (aubergine), strawberry, and mustard.",Strong flavoured and nutritious vegetable. Wash well and chop finely then steam. A tomato or cheese sauce will mask the flavour if too strong.,,http://gardenate.com/plant/Kale
Kohlrabi,,Kohlrabi is easy to grow. Sow in the garden. Sow the seed at a depth approximately three times the diameter of the seed. Kohlrabi is best planted at soil temperatures between 46°F and 86°F.,Space plants 4 - 10 inches apart.,Harvest them in 7-10 weeks.,"Kohlrabi can grow beside Beets, celery, cucumber, onions, marigold, nasturtium, rhubarb, and aromatic herbs (sage, dill, chamomile).","Avoid growing Kohlrabi close to Climbing (pole) beans, tomato, peppers (chilli, capsicum), eggplant (aubergine), strawberry, mustard.","Use when young. Scrub well, cut off leaf stalks, roots and woody parts. Young ones do not need peeling. Can be grated raw for salads or cut in pieces and steam. Use in casseroles.",,http://gardenate.com/plant/Kohlrabi
Leeks,,"Leeks are easy to grow. Grow then in seed trays, and plant out in 4-6 weeks. Sow the seed at a depth approximately three times the diameter of the seed. Leeks are best planted at soil temperatures between 46°F and 86°F.",Space plants 4 - 8 inches apart.,Harvest them in 15-18 weeks. Loosen with a fork rather than pull by hand.,Leeks can grow beside Carrots.,,"Trim off the roots and any damaged leaves. Young ones can be used whole with some of the green leaves. Wash thoroughly as the earth tends to get inside. Chop and fry in butter (or olive oil) until tender. Can be added to casserole meals, allowing time to cook through. Leek and mushroom make a tasty combination for a tart filling.",,http://gardenate.com/plant/Leeks
Lemon Balm,Sweet balm,Lemon balm is easy to grow. Sow it in the garden. Sow the seed at a depth approximately three times the diameter of the seed. Lemon balm is best planted at soil temperatures between 50°F and 77°F.,Space plants 10 inches apart.,Harvest them in 8-10 weeks. Cut back tall stems to prevent flowering.,Lemon balm is good to attract bees.,,"As a herb tea or added to fruit punch. Can be used to replace lemon, used sparingly, in desserts and with stewed fruit. Chop leaves into salad. Better used fresh than dried.",,http://gardenate.com/plant/Lemon%2BBalm
Lettuce,,"Lettuce is easy to grow. Sow in the garden, or start in seed trays and plant out in 4-6 weeks. Sow the seed at a depth approximately three times the diameter of the seed. Lettuce is best planted at soil temperatures between 8°C and 27°C.",Space plants 20 - 30 cm apart.,Harvest them in 8-12 weeks.,"Lettuce can grow beside Carrots, Onions, Strawberries, Beets, Brassicas, Radish, Marigold, Borage, Chervil, Florence fennel, and leeks.","Avoid growing lettuce close to Parsley or Celery.","Wash well, spin or shake dry and use in salads and sandwiches",,http://gardenate.com/plant/Lettuce
Luffa,"Loofah, plant sponge","Grow luffa in seed trays, and plant out in 4-6 weeks. Sow the seed at a depth approximately three times the diameter of the seed. Luffa is best planted at soil temperatures between 68°F and 86°F.",Space plants 18 - 30 inches apart.,Harvest them in 11-12 weeks. Use as a back scratcher.,"Luffa can grow beside Peas, Beans, Onions, and Sweetcorn.",Avoid growing luffa close to Potatoes.,The luffa flowers and fruits are soft and edible when young and are sometimes cooked and eaten like squash or okra. Loofah has been an important food source in many Asian cultures. The leaves and vines should not be eaten.,,http://gardenate.com/plant/Luffa
Marrow,,"Grow marrow in seed trays, and plant out in 4-6 weeks. Sow the seed at a depth approximately three times the diameter of the seed. Marrow is best planted at soil temperatures between 68°F and 95°F.",Space plants 35 - 47 inches apart.,Harvest them in 12-17 weeks.,"Marrow can grow beside Peas, Beans, Onions, and Sweetcorn.",Avoid growing marrow close to Potatoes.,"Good, cut in thick slices, seeds removed and stuffed with mince or spicy vegetable mix then baked in the oven",,http://gardenate.com/plant/Marrow
Mint,Garden mint,Mint is easy to grow. Grow in trays and plant out or start from cuttings. Sow the seed at a depth approximately three times the diameter of the seed. Mint is best planted at soil temperatures between 70°F and 75°F.,Space plants 12 inches apart.,Harvest them in 8-12 weeks. Cut leaves from top with scissors.,"Mint can grow beside Cabbages and Tomatoes",,Mint adds a fresh flavour if chopped and sprinkled over salads and is traditionally used mixed with vinegar and sugar to make mint sauce for lamb.,,http://gardenate.com/plant/Mint
Mizuna,"Japanese Greens, Mitzuna, Mibuna",Mizuna is easy to grow. Sow in the garden. Sow the seed at a depth approximately three times the diameter of the seed. Mizuna is best planted at soil temperatures between 50°F and 86°F.,Space plants 6 - 8 inches apart.,Harvest them in 35-50 days.,"Mizuna can grow beside Radish and lettuce.",,"Leaves used raw, stir-fried, in soups. Young flowering stems can be cooked like broccoli.",,http://gardenate.com/plant/Mizuna
Mustard greens,Gai choy,Mustard greens are easy to grow. Sow in the garden. Sow the seed at a depth approximately three times the diameter of the seed. Mustard greens are best planted at soil temperatures between 50°F and 95°F.,Space plants 14 - 24 inches apart.,Harvest them in 5-8 weeks.,"Mustard greens can grow beside Dwarf (bush) beans, beets, celery, cucumber, onions, marigold, nasturtium, rhubarb, and aromatic herbs (sage, dill, camomile).","Avoid growing mustard greens close to Climbing (pole) beans, tomato, peppers (chilli, capsicum), eggplant (aubergine), and strawberry.",Use young leaves in salad for a 'spicy kick'. Add to stir fry.,,http://gardenate.com/plant/Mustard%2Bgreens
Okra,"Ladyfinger, gumbo","Grow okra in seed trays, and plant out in 4-6 weeks. Sow the seed at a depth approximately three times the diameter of the seed. Okra is best planted at soil temperatures between 68°F and 95°F.",Space plants 14 - 24 inches apart.,Harvest them in 11-14 weeks.,"Okra can grow beside Peppers (Capsicum, Chili), and Eggplant (Aubergine).",,Use pods fresh or dried in soups or casseroles or as a boiled vegetable.,,http://gardenate.com/plant/Okra
Onion,,"Onions are easy to grow. Grow in seed trays, and plant out in 4-6 weeks. Sow the seed at a depth approximately three times the diameter of the seed. Onions are best planted at soil temperatures between 46°F and 86°F.",Space plants 2 - 4 inches apart.,Harvest them in 25-34 weeks. Allow onions to dry before storing.,"Onions can grow beside Lemon Balm, Borage, Carrots, Beets, Silverbeet, Lettuce, and Amaranth.","Avoid growing onions close to Peas or Beans.",Brown onions roasted whole with other vegetables are delicious. Red onions add colour to salads or stir-fry.,,http://gardenate.com/plant/Onion
Oregano,Pot Marjoram,"Sow oregano in the garden, or start in seed trays. Sow the seed at a depth approximately three times the diameter of the seed. Oregano is best planted at soil temperatures between 64°F and 77°F.",Space plants 6 inches apart.,Harvest them in 6-8 weeks when flowers appear.,Oregano can grow beside Broccoli.,,"Used to flavour tomato dishes, soups, sauces and Greek dishes like moussaka",,http://gardenate.com/plant/Oregano
Pak Choy,Pak choi,Pak choy is easy to grow. Sow in the garden. Sow the seed at a depth approximately three times the diameter of the seed. Pak choy is best planted at soil temperatures between 70°F and 86°F.,Space plants 12 - 16 inches apart.,Harvest them in 6-11 weeks.,"Pak choy can grow beside Dwarf (bush) beans, beets, celery, cucumber, onions, marigold, nasturtium, rhubarb, aromatic herbs (sage, dill, chamomile, coriander), lettuce, and potatoes.","Avoid growing pak choy close to Climbing (pole) beans, tomato, peppers (chili, capsicum), eggplant (aubergine), strawberry, and mustard.","You can treat Pak Choy as ""cut and come again "" or use the whole plant in one go, whichever suits your needs.",,http://gardenate.com/plant/Pak%2BChoy
Parsley,Curly leaf parsley or flat leaf (Italian) parsley,Parsley is easy to grow. Sow it in the garden. Sow the seed at a depth approximately three times the diameter of the seed. Parsley is best planted at soil temperatures between 50°F and 86°F.,Space plants 8 - 12 inches apart.,Harvest them in 9-19 weeks. Cut stalks from outer part of plant.,"Parsley can grow beside Carrots, Chives, Tomatoes, and Asparagus.",Avoid growing parsley close to Potatoes.,"Use the leaves and stems to add flavour and colour. Can be cooked in dishes such as ratatouille, Traditionally used in white sauce.",,http://gardenate.com/plant/Parsley
Parsnip,,Sow parsnips in the garden. Sow the seed at a depth approximately three times the diameter of the seed. Parsnips are best planted at soil temperatures between 43°F and 70°F.,Space plants 3 - 4 inches apart.,Harvest them in 17-20 weeks. Parsnips have their best flavour if harvested after a frost.,"Parsnips can grow beside Swiss Chard (Silverbeet), Capsicum, Peas, Potatoes, Beans, Radishes, and Garlic.","Avoid growing parsnips close to Carrot, Celery, or Brassicas.",Peel and roast with vegetables or meat. The sweetish flavour of parsnips enhances most other vegetables.,,http://gardenate.com/plant/Parsnip
Peas,,Peas are easy to grow. Sow in the garden. Sow the seed at a depth approximately three times the diameter of the seed. Peas are best planted at soil temperatures between 8°C and 24°C.,Space plants 5 - 8 cm apart.,Harvest them in 9-11 weeks. Pick the pods every day to increase production.,Peas can grow beside Potatoes.,,Raw straight from the pod in the garden is best! Raw in salads. Steamed lightly. Small pods can be steamed whole.,,http://gardenate.com/plant/Peas
Potato,,Plant the tuber. Potatoes are best planted at soil temperatures between 50°F and 86°F.,Space plants 12 - 16 inches apart.,"Harvest them in 15-20 weeks. Dig carefully, avoid damaging the potatoes.","Potatoes can grow beside Peas, Beans, Brassicas, Sweetcorn, Broad Beans, Nasturtiums, and Marigolds.","Avoid growing potatoes close to Cucumber, Pumpkin, Sunflowers, Tomatoes, or Rosemary.","Peeled or unpeeled and scrubbed, potatoes can be boiled, baked, fried and roasted. - The only way they are not used is raw. Keep in a pot of cold water after peeling, otherwise they will discolour.",,http://gardenate.com/plant/Potato
Pumpkin,,Pumpkin is easy to grow. Sow in the garden. Sow the seed at a depth approximately three times the diameter of the seed. Pumpkin is best planted at soil temperatures between 68°F and 90°F.,Space plants 35 - 47 inches apart.,Harvest them in 15-20 weeks.,Pumpkin can grow beside Sweet Corn.,Avoid growing pumpkin close to Potatoes.,"Cut up, remove the skin and roast with other vegetables or meat. Young crisp shoots with young leaves can be cooked and eaten - stewed in coconut milk they are popular in Melanesia. Remove any strings and tough parts and stew until tender, or cook as a vegetable in boiling water 3-5 minutes.",,http://gardenate.com/plant/Pumpkin
Radish,,Radishes are easy to grow. Sow in the garden. Sow the seed at a depth approximately three times the diameter of the seed. Radishes are best planted at soil temperatures between 46°F and 86°F.,Space plants 1 - 2 inches apart.,Harvest them in 5-7 weeks.,"Radishes can grow beside Chervil, cress, lettuce, leeks, spinach, strawberries, and tomatoes.","Avoid growing radishes close to Hyssop or gherkins.",Wash well and remove leaves and roots. Use raw in salads or on their own with bread and butter.,,http://gardenate.com/plant/Radish
Rhubarb,,Rhubarb is easy to grow. Plant pieces of rhizome or roots 8 - 10 cm (3 - 4 in.) deep. Rhubarb is best planted at soil temperatures between 41°F and 68°F.,Space plants 35 inches apart.,Harvest them in approximately 1 years. You will have a stronger plant if you leave it for about a year before using.,"Rhubarb can grow beside Brassicas such as Cabbage, Broccoli, Cauliflower, etc.",,"Pick stems about the thickness of your finger. Large stems will have tough 'strings' down the length of them. Use in pies, crumbles, fools and jams. Rhubarb goes well with orange. Will usually need sweetener.",,http://gardenate.com/plant/Rhubarb
Rocket,Arugula/Rucola,Arugula is easy to grow. Sow in the garden. Sow the seed at a depth approximately three times the diameter of the seed. Arugula is best planted at soil temperatures between 50°F and 77°F.,Space plants 6 - 8 inches apart.,Harvest them in 21-35 days.,Arugula can grow beside Lettuce.,,Use arugula in salads and stir-fry.,,http://gardenate.com/plant/Rocket
Rockmelon,Canteloupe,"Grow canteloupe in seed trays, and plant out in 4-6 weeks. Sow the seed at a depth approximately three times the diameter of the seed. Canteloupe is best planted at soil temperatures between 68°F and 90°F.",Space plants 16 - 24 inches apart.,Harvest them in 10-16 weeks.,"Canteloupe can grow beside Sweetcorn and Sunflowers.",Avoid growing canteloupe close to Potatoes.,Cut in half and scoop out and discard the seeds. Sprinkle with some ground ginger or serve plain.,,http://gardenate.com/plant/Rockmelon
Rosella,"Queensland Jam Plant, Roselle","Sow rosella in the garden, or start in seed trays. Sow the seed at a depth approximately three times the diameter of the seed. Rosella is best planted at soil temperatures between 20°C and 35°C.",Space plants 140 cm apart.,Harvest them in 21-25 weeks.,"Rosella can grow beside Feverfew, Coriander, Nasturtium and Hyssop.",,"The large flowers produce a crimson enlarged calyx. Use the fleshy red calyx, without the green seed pod to make jam or jelly.",,http://gardenate.com/plant/Rosella
Rosemary,,Rosemary is easy to grow. Plant cuttings. Rosemary is best planted at soil temperatures between 59°F and 68°F.,Space plants 39 - 59 inches apart.,"Harvest them in approximately 1 years. In warmer areas, harvest time might be shorter.","Rosemary can grow beside Beans, Carrots, Cabbages, and Sage.",Avoid growing rosemary close to Potatoes.,"Leaves sprinkled on roast potatoes, meat and barbeque food make them extra tasty. Rosemary can also be used to add flavour to vinegars and oils.",,http://gardenate.com/plant/Rosemary
Rutabaga,Swedes,Rutabaga is easy to grow. Sow in the garden. Sow the seed at a depth approximately three times the diameter of the seed. Rutabaga is best planted at soil temperatures between 45°F and 77°F.,Space plants 4 - 8 inches apart.,Harvest them in 10-14 weeks.,"Rutabaga can grow beside Peas, Beans, and Chives.",Avoid growing Rutabaga close to Potatoes.,Use when about the size of a tennis ball. The leaves can be cooked like cabbage when young.,,http://gardenate.com/plant/Rutabaga
Sage,Common Sage,Sow sage in the garden. Sow the seed at a depth approximately three times the diameter of the seed. Sage is best planted at soil temperatures between 50°F and 77°F.,Space plants 20 inches apart.,Harvest them in approximately 18 months. Time is reduced if grown from cuttings.,"Sage can grow beside Broccoli, Cauliflower, Rosemary, Cabbage and Carrots.",,The leaves are used to flavour stuffing and meat dishes. Sage keeps well if dried.,,http://gardenate.com/plant/Sage
Salsify,Vegetable oyster,Salsify is easy to grow. Sow in the garden. Sow the seed at a depth approximately three times the diameter of the seed. Salsify is best planted at soil temperatures between 50°F and 86°F.,Space plants 6 - 8 inches apart.,Harvest them in 14-21 weeks.,"Salsify can grow beside Beans, Brassicas, Carrots, Celeriac, Endive, Kohl-rabi, Leeks, Lettuce, Alliums, and Spinach.",,Wash and scrape the roots then boil before frying or roasting. They can also be used to make a creamed soup.,,http://gardenate.com/plant/Salsify
Savory - summer savory,Bean Herb,Bean herb is easy to grow. Sow in the garden. Lightly cover. Sow the seed at a depth approximately three times the diameter of the seed. Bean herb is best planted at soil temperatures between 64°F and 86°F.,Space plants 10 inches apart.,Harvest them in 6-10 weeks. Cut before flowers form for best flavour.,"Bean herb can grow beside Beans and Onions.",,"Usually added to peas, beans or lentils. It has a slightly spicy flavour.",,http://gardenate.com/plant/Savory%2B-%2Bsummer%2Bsavory
Savory - winter savory,Savory,Savory is easy to grow. Start in trays. Cover seed lightly. Sow the seed at a depth approximately three times the diameter of the seed. Savory is best planted at soil temperatures between 64°F and 86°F.,Space plants 12 - 16 inches apart.,Harvest them in 6-10 weeks. Use the leaves fresh.,Savory can grow beside Beans.,,Savory can be used as seasoning for beans and other green vegetables.,,http://gardenate.com/plant/Savory%2B-%2Bwinter%2Bsavory
Shallots,Eschalots,"Shallots are easy to grow. Plant small bulblets, with stem just showing above ground. Shallots are best planted at soil temperatures between 46°F and 86°F.",Space plants 6 - 8 inches apart.,Harvest them in 12-15 weeks. Keep a few for your next planting.,"Shallots can grow beside Lemon Balm, Borage, Carrots, Beets, Silverbeet, Lettuce, and Amaranth.","Avoid growing shallots close to Peas or Beans.","Use in any recipe instead of onions. Can be cooked whole, braised gently with other vegetables.",Shallots can be pickled.,http://gardenate.com/plant/Shallots
Silverbeet,Swiss Chard or Mangold,Silverbeet is easy to grow. Sow in the garden. Sow the seed at a depth approximately three times the diameter of the seed. Silverbeet is best planted at soil temperatures between 50°F and 86°F.,Space plants 6 - 12 inches apart.,Harvest them in 7-12 weeks.,"Silverbeet can grow beside Beans, brassica sp. (cabbage, cauliflower, etc), tomato, allium sp. (onion, garlic, chives), lavender, and parsnip.","Avoid growing Silverbeet close to Corn, melon, cucurbit (cucumbers, squash, melons, gourds), most herbs, or potato.",Wash thoroughly and inspect the back of the leaves for insects. Chop and put in a saucepan with very little water ( or just what is on the leaves). Cover and cook over a low to medium heat until the leaves collapse. A small amount of nutmeg enhances the flavour.,,http://gardenate.com/plant/Silverbeet
Snow Peas,"Sugar Peas, Mangetout, Chinese Peas",Snow peas are easy to grow. Sow in the garden. Sow the seed at a depth approximately three times the diameter of the seed. Snow peas are best planted at soil temperatures between 46°F and 68°F.,Space plants 3 - 4 inches apart.,Harvest them in 12-14 weeks.,"Snow peas can grow beside Carrots, Endive, Florence fennel, Winter lettuce, and Brassicas.","Avoid growing snow peas close to Chives, Alliums, Tomatoes.",Cook snow peas whole or eat raw in salads,,http://gardenate.com/plant/Snow%2BPeas
Spinach,English spinach,Spinach is easy to grow. Sow in the garden. Sow the seed at a depth approximately three times the diameter of the seed. Spinach is best planted at soil temperatures between 50°F and 77°F.,Space plants 8 - 12 inches apart.,Harvest them in 5-11 weeks.,"Spinach can grow beside Broad beans (fava), cabbage, cauliflower, celery, eggplant (aubergine), onion, peas, strawberry, and santolina.",,Use young leaves in salad. Steam and add to other vegetables.,,http://gardenate.com/plant/Spinach
Spring onions,"Scallions, Bunching onions, Welsh onion",Spring onions are easy to grow. Sow in the garden. Sow the seed at a depth approximately three times the diameter of the seed. Spring onions are best planted at soil temperatures between 50°F and 68°F.,Space plants close together.,Harvest them in 8-12 weeks.,"Spring onions can grow beside Lemon Balm, Borage, Carrots, Beets, Silverbeet, Lettuce, and Amaranth.","Avoid growing spring onions close to Peas or Beans.",Spring onions can be eaten raw in salads. They are often used chopped and sprinkled on Asian stir-fry.,,http://gardenate.com/plant/Spring%2Bonions
Squash,"Crookneck, Pattypan, Summer squash","Grow squash in seed trays, and plant out in 4-6 weeks. Sow the seed at a depth approximately three times the diameter of the seed. Squash is best planted at soil temperatures between 70°F and 95°F.",Space plants 24 - 31 inches apart.,Harvest them in 7-8 weeks.,Squash can grow beside Sweet corn.,,Use squash whole or sliced. Steam or fry.,,http://gardenate.com/plant/Squash
Strawberries (from seeds),,Start strawberries inside in pots or trays after chilling seeds. Sow the seed at a depth approximately three times the diameter of the seed. Strawberries are best planted at soil temperatures between 50°F and 68°F.,Space plants 12 - 39 inches apart.,Harvest them in approximately 1 years. Seedlings need to grow for about a year before fruiting. Remove first flowers.,Strawberries are better in a bed on their own to allow good sun and air circulation.,"If you are using rotation beds, avoid putting strawberries where you have grown tomatoes, potatoes, peppers or eggplant.","Strawberries can be used in any dessert needing soft fruit or berries. Summer pudding with raspberries and blackberries or boysenberries, mousse, trifle, dipped in melted chocolate or just with cream. Sprinkle a bowl of strawberries with balsamic vinegar and a little sugar to enhance the flavour and colour.Straight from the garden, warmed by the sun is best.",,http://gardenate.com/plant/Strawberries%2B(from%2Bseeds)
Strawberry Plants,,Strawberry plants are easy to grow. Plant them with the crown (of the roots) just covered. Strawberry plants are best planted at soil temperatures between 50°F and 68°F.,Space plants 12 - 39 inches apart.,"Harvest them in approximately 11 weeks. Strawberries bruise easily when ripe, handle them carefully. Pick them with a small piece of stem attached.",Strawberry plants are better in a bed on their own to allow good sun and air circulation.,"If you are using rotation beds, avoid putting strawberries where you have grown tomatoes, potatoes, peppers or eggplant.","Pick strawberries and eat them straight from the garden - warm from the sunshine, delicious! Strawberries can be used in any dessert needing soft fruit or berries. Summer pudding which also has raspberries and blackberries or boysenberries, mousse, trifle, dipped in melted chocolate or just with cream. Sprinkle a bowl of strawberries with balsamic vinegar and a little sugar to enhance the flavour and colour.",,http://gardenate.com/plant/Strawberry%2BPlants
Sunflower,,Sow sunflowers in the garden. Sow the seed at a depth approximately three times the diameter of the seed. Sunflowers are best planted at soil temperatures between 50°F and 86°F.,Space plants 8 - 12 inches apart.,Harvest them in 10-11 weeks.,"Sunflowers can grow beside Cucumbers, Melons, Sweetcorn, and Squash.",Avoid growing sunflowers close to Potatoes.,Use sunflower seeds fresh or toasted.,,http://gardenate.com/plant/Sunflower
